{
  "contract_type": "autosafe_feature_contract",
  "version": "v57.0-scaffold",
  "history_window": {
    "start": "2019-01-01",
    "rule": "Training matrices and the serving path both discard MOT tests before this date; full-depth serving is deferred to v58 after the results-lake re-ingest."
  },
  "parity": {
    "tolerance": 1e-09
  },
  "point_in_time_rule": "Every feature uses only data available strictly before the target test date, and only tests dated >= history_window.start",
  "artifact_dependencies": [
    "cohort_stats.pkl",
    "model_hierarchical_features.pkl",
    "segment_hierarchical_features.pkl",
    "model_age_hierarchical.pkl",
    "calibrator.json"
  ],
  "decision_provenance": {
    "rc3_dropped": [
      "station_fail_rate_smoothed",
      "station_x_prev_outcome_fail_rate",
      "station_strictness_bias",
      "suspension_risk_profile"
    ],
    "observed_renames": {
      "n_prior_tests": "n_prior_tests_observed",
      "n_prior_fails": "n_prior_fails_observed",
      "prev_count_advisory": "prior_advisory_count_observed",
      "has_ever_failed_brakes": "has_observed_failure_brakes",
      "has_ever_failed_tyres": "has_observed_failure_tyres",
      "has_ever_failed_suspension": "has_observed_failure_suspension",
      "fails_last_365d": "fails_last_365d_observed",
      "fails_last_730d": "fails_last_730d_observed",
      "prior_fail_rate_smoothed": "prior_fail_rate_observed",
      "has_prior_advisory_brakes": "has_prior_advisory_brakes_observed",
      "has_prior_advisory_tyres": "has_prior_advisory_tyres_observed",
      "has_prior_advisory_suspension": "has_prior_advisory_suspension_observed",
      "tests_since_last_advisory_brakes": "tests_since_last_advisory_brakes_observed",
      "tests_since_last_advisory_tyres": "tests_since_last_advisory_tyres_observed",
      "tests_since_last_advisory_suspension": "tests_since_last_advisory_suspension_observed",
      "advisory_in_last_1_brakes": "advisory_in_last_1_brakes_observed",
      "advisory_in_last_1_tyres": "advisory_in_last_1_tyres_observed",
      "advisory_in_last_1_suspension": "advisory_in_last_1_suspension_observed",
      "advisory_in_last_2_brakes": "advisory_in_last_2_brakes_observed",
      "advisory_in_last_2_tyres": "advisory_in_last_2_tyres_observed",
      "advisory_in_last_2_suspension": "advisory_in_last_2_suspension_observed",
      "advisory_streak_len_brakes": "advisory_streak_len_brakes_observed",
      "advisory_streak_len_tyres": "advisory_streak_len_tyres_observed",
      "advisory_streak_len_suspension": "advisory_streak_len_suspension_observed",
      "miles_since_last_advisory_tyres": "miles_since_last_advisory_tyres_observed",
      "miles_since_last_advisory_suspension": "miles_since_last_advisory_suspension_observed",
      "has_prior_failure_brakes": "has_prior_failure_brakes_observed",
      "has_prior_failure_tyres": "has_prior_failure_tyres_observed",
      "has_prior_failure_suspension": "has_prior_failure_suspension_observed",
      "failure_streak_len_brakes": "failure_streak_len_brakes_observed",
      "failure_streak_len_tyres": "failure_streak_len_tyres_observed",
      "failure_streak_len_suspension": "failure_streak_len_suspension_observed",
      "tests_since_last_failure_brakes": "tests_since_last_failure_brakes_observed",
      "tests_since_last_failure_tyres": "tests_since_last_failure_tyres_observed",
      "tests_since_last_failure_suspension": "tests_since_last_failure_suspension_observed"
    },
    "coverage_features": [
      "first_observed_test_is_not_true_first",
      "has_left_truncated_history",
      "has_prior_test_observed",
      "history_years_observed",
      "window_days_available"
    ],
    "directive": "v57 Stage-1, 2026-06-12"
  },
  "features": [
    {
      "name": "prev_cycle_outcome_band",
      "dtype": "categorical",
      "default": null,
      "source": "v55:prev_cycle_outcome_band",
      "prediction_time_available": true,
      "window_bounded": false
    },
    {
      "name": "gap_band",
      "dtype": "categorical",
      "default": null,
      "source": "v55:gap_band",
      "prediction_time_available": true,
      "window_bounded": false
    },
    {
      "name": "make",
      "dtype": "categorical",
      "default": null,
      "source": "v55:make",
      "prediction_time_available": true,
      "window_bounded": false
    },
    {
      "name": "advisory_trend",
      "dtype": "categorical",
      "default": null,
      "source": "v55:advisory_trend",
      "prediction_time_available": true,
      "window_bounded": false
    },
    {
      "name": "test_mileage",
      "dtype": "float",
      "default": 0,
      "source": "v55:test_mileage",
      "prediction_time_available": true,
      "window_bounded": false
    },
    {
      "name": "prior_advisory_count_observed",
      "dtype": "float",
      "default": 0,
      "source": "v55:prev_count_advisory",
      "prediction_time_available": true,
      "window_bounded": true
    },
    {
      "name": "days_since_last_test",
      "dtype": "float",
      "default": 0,
      "source": "v55:days_since_last_test",
      "prediction_time_available": true,
      "window_bounded": false
    },
    {
      "name": "prior_fail_rate_observed",
      "dtype": "float",
      "default": 0,
      "source": "v55:prior_fail_rate_smoothed",
      "prediction_time_available": true,
      "window_bounded": true
    },
    {
      "name": "n_prior_tests_observed",
      "dtype": "float",
      "default": 0,
      "source": "v55:n_prior_tests",
      "prediction_time_available": true,
      "window_bounded": true
    },
    {
      "name": "make_fail_rate_smoothed",
      "dtype": "float",
      "default": 0,
      "source": "v55:make_fail_rate_smoothed",
      "prediction_time_available": true,
      "window_bounded": false
    },
    {
      "name": "segment_fail_rate_smoothed",
      "dtype": "float",
      "default": 0,
      "source": "v55:segment_fail_rate_smoothed",
      "prediction_time_available": true,
      "window_bounded": false
    },
    {
      "name": "model_fail_rate_smoothed",
      "dtype": "float",
      "default": 0,
      "source": "v55:model_fail_rate_smoothed",
      "prediction_time_available": true,
      "window_bounded": false
    },
    {
      "name": "days_late",
      "dtype": "float",
      "default": 0,
      "source": "v55:days_late",
      "prediction_time_available": true,
      "window_bounded": false
    },
    {
      "name": "prev_adv_brakes",
      "dtype": "float",
      "default": 0,
      "source": "v55:prev_adv_brakes",
      "prediction_time_available": true,
      "window_bounded": false
    },
    {
      "name": "prev_adv_suspension",
      "dtype": "float",
      "default": 0,
      "source": "v55:prev_adv_suspension",
      "prediction_time_available": true,
      "window_bounded": false
    },
    {
      "name": "prev_adv_steering",
      "dtype": "float",
      "default": 0,
      "source": "v55:prev_adv_steering",
      "prediction_time_available": true,
      "window_bounded": false
    },
    {
      "name": "prev_adv_tyres",
      "dtype": "float",
      "default": 0,
      "source": "v55:prev_adv_tyres",
      "prediction_time_available": true,
      "window_bounded": false
    },
    {
      "name": "mileage_cohort_ratio",
      "dtype": "float",
      "default": 0,
      "source": "v55:mileage_cohort_ratio",
      "prediction_time_available": true,
      "window_bounded": false
    },
    {
      "name": "advisory_cohort_delta",
      "dtype": "float",
      "default": 0,
      "source": "v55:advisory_cohort_delta",
      "prediction_time_available": true,
      "window_bounded": false
    },
    {
      "name": "days_since_pass_ratio",
      "dtype": "float",
      "default": 0,
      "source": "v55:days_since_pass_ratio",
      "prediction_time_available": true,
      "window_bounded": false
    },
    {
      "name": "multi_system_advisory_count",
      "dtype": "float",
      "default": 0,
      "source": "v55:multi_system_advisory_count",
      "prediction_time_available": true,
      "window_bounded": false
    },
    {
      "name": "n_prior_fails_observed",
      "dtype": "float",
      "default": 0,
      "source": "v55:n_prior_fails",
      "prediction_time_available": true,
      "window_bounded": true
    },
    {
      "name": "fails_last_365d_observed",
      "dtype": "float",
      "default": 0,
      "source": "v55:fails_last_365d",
      "prediction_time_available": true,
      "window_bounded": true
    },
    {
      "name": "fails_last_730d_observed",
      "dtype": "float",
      "default": 0,
      "source": "v55:fails_last_730d",
      "prediction_time_available": true,
      "window_bounded": true
    },
    {
      "name": "fail_rate_trend",
      "dtype": "float",
      "default": 0,
      "source": "v55:fail_rate_trend",
      "prediction_time_available": true,
      "window_bounded": false
    },
    {
      "name": "recent_fail_intensity",
      "dtype": "float",
      "default": 0,
      "source": "v55:recent_fail_intensity",
      "prediction_time_available": true,
      "window_bounded": false
    },
    {
      "name": "mdps_score",
      "dtype": "float",
      "default": 0,
      "source": "v55:mdps_score",
      "prediction_time_available": true,
      "window_bounded": false
    },
    {
      "name": "front_end_advisory_intensity",
      "dtype": "float",
      "default": 0,
      "source": "v55:front_end_advisory_intensity",
      "prediction_time_available": true,
      "window_bounded": false
    },
    {
      "name": "brake_system_stress",
      "dtype": "float",
      "default": 0,
      "source": "v55:brake_system_stress",
      "prediction_time_available": true,
      "window_bounded": false
    },
    {
      "name": "commercial_wear_proxy",
      "dtype": "float",
      "default": 0,
      "source": "v55:commercial_wear_proxy",
      "prediction_time_available": true,